level,type,text,question1,question2
5,expository,"""Urban green infrastructure represents an indispensable component of sustainable metropolitan development paradigms and exerts profound influence on environmental quality parameters and public health outcomes. Contemporary cities worldwide progressively recognize the imperative necessity of integrating comprehensive vegetation systems, recreational parks, and natural landscapes into sophisticated urban planning frameworks.\n""
""Metropolitan regions featuring abundant green infrastructure demonstrate quantifiably superior atmospheric quality indicators. Trees and botanical specimens function as sophisticated biological filtration mechanisms, systematically absorbing atmospheric carbon dioxide concentrations while simultaneously releasing oxygen through complex photosynthetic biochemical processes. This natural purification system effectively neutralizes airborne contaminants, which constitute predominant environmental hazards in densely populated urban centers. When residents consistently inhale purified atmospheric conditions, they experience substantially diminished prevalence of respiratory pathologies, cardiovascular complications, and other pollution-induced physiological disorders.\n""
""Green spaces additionally furnish essential thermoregulatory mechanisms within urban microclimates. Cities characteristically exhibit significantly elevated ambient temperatures compared to peripheral rural territories due to the urban heat island phenomenon, wherein concrete infrastructure and architectural structures systematically absorb and retain solar thermal radiation. Trees provide organic cooling systems through shade provision and evapotranspiration processes, which discharge moisture vapor into surrounding atmospheric conditions. This biological cooling mechanism substantially reduces dependency on energy-intensive mechanical climate control technologies, consequently minimizing electricity consumption and associated operational expenditures.\n""
""Public parks and botanical gardens constitute accessible recreational facilities for metropolitan inhabitants. Numerous urban residents lack private outdoor spaces, rendering communal green environments essential for physical activities and psychological wellness maintenance. These spaces accommodate diverse recreational pursuits including cardiovascular exercise regimens, contemplative meditation practices, and social community gatherings. Children benefit substantially from secure outdoor recreational environments, while adults can participate in comprehensive fitness programs or rejuvenate in tranquil natural surroundings. Consistent exposure to natural environments demonstrates empirically validated therapeutic benefits, including stress mitigation and enhanced emotional equilibrium.
""Urban green corridors simultaneously facilitate biodiversity conservation initiatives by establishing viable habitats for diverse wildlife populations. Even relatively modest parks can sustain thriving communities of avian species, arthropod populations, and small mammalian species, contributing to ecological stability within metropolitan ecosystems. These interconnected green networks enable species migration patterns and genetic diversity preservation, which are fundamental for urban environmental resilience.\n""
""However, implementing comprehensive urban greening initiatives presents formidable logistical and economic challenges. Prime metropolitan real estate commands exceptionally high market valuations, rendering land acquisition for park development economically prohibitive for municipal budgets. Occasionally, existing infrastructure requires systematic demolition to accommodate new green spaces, potentially displacing established residential or commercial enterprises and generating substantial community resistance.\n""
""Municipal administrations must allocate considerable financial resources for perpetual maintenance of green infrastructure systems. Parks demand continuous horticultural management, sophisticated irrigation networks, comprehensive security surveillance, and facility maintenance protocols. During periods of meteorological drought, sustaining vegetation becomes particularly resource-intensive and financially burdensome.\n""
""Ensuring equitable geographical distribution of green amenities across socioeconomically diverse neighborhoods represents another formidable challenge requiring strategic intervention and comprehensive policy reform.\n""",都市緑化が環境と健康に与える恩恵を2つ挙げて、それぞれの科学的根拠を説明してください。（50語以内）,都市緑化プロジェクトを推進する際の主要な制約は何だと思いますか。テキストの内容に基づいて答えてください。（50語以内）
6,narrative,"""My name is Yuki. I am an undergraduate student pursuing a rigorous academic trajectory in economics. Last month, I endeavored to secure employment at an intimate coffee establishment strategically situated adjacent to my university campus.\n""
""I experienced profound trepidation on my inaugural professional engagement. I had never previously cultivated competency within the hospitality sector's operational paradigms. The manager, Mr. Tanaka, exhibited extraordinary forbearance and magnanimity throughout my comprehensive orientation process. He meticulously elucidated the sophisticated artisanal techniques requisite for crafting diverse specialty coffee beverages and articulated comprehensive customer service protocols with remarkable precision. My colleagues demonstrated exceptional solidarity and consistently provided invaluable mentorship whenever I encountered procedural impediments or operational complexities.\n""
""Initially, every occupational responsibility appeared formidable and insurmountable. I struggled to assimilate the extensive menu encompassing numerous intricate specialty beverages with their elaborate compositional specifications. My manual dexterity proved woefully inadequate while manipulating the sophisticated espresso machinery's complex mechanisms. Intermittently, I committed egregious computational miscalculations during monetary transactions, inducing profound mortification and professional embarrassment. I experienced considerable distress when patrons exhibited overt frustration due to protracted service intervals and operational inefficiencies.\n""
""Nevertheless, following approximately two weeks of rigorous practice and unwavering perseverance, my professional competency progressed substantially. I cultivated enhanced proficiency in beverage preparation methodologies and systematically memorized the individualized preferences and dietary specifications of regular clientele. These familiar patrons consistently acknowledged my presence with effusive greetings and commendations, substantially augmenting my professional confidence and self-efficacy.\n""
""Currently, I derive immense gratification from my employment at this distinguished establishment. I adhere to a meticulously structured schedule encompassing three afternoon shifts weekly, strategically coordinated with my demanding academic obligations. The remuneration I receive facilitates autonomous procurement of educational resources and comprehensive management of personal expenditures. More profoundly, this vocational experience furnished invaluable insights regarding collaborative workplace dynamics and sophisticated interpersonal communication strategies across diverse demographic constituencies.\n""
""My parents articulate profound admiration concerning my emerging professional maturity and burgeoning financial autonomy. My university associates periodically frequent the establishment to observe my occupational progression, invariably commenting that I manifest authentic fulfillment while serving our diverse clientele.\n""
""I aspire to perpetuate this position throughout my remaining undergraduate academic tenure, recognizing its transformative impact on my personal and professional development.\n""",ユキがアルバイト開始時に遭遇した困難を2つ挙げ、それらがどのように解決されたかを詳述してください。（50語以内）,このアルバイト経験でユキが習得した技能はどのようなものだと考えられますか。テキストの記述を根拠に答えてください。（50語以内）
6,expository,"""Urban green infrastructure constitutes an indispensable cornerstone of sustainable metropolitan development paradigms and exerts profound ramifications on environmental quality parameters and public health outcomes. Contemporary cities worldwide progressively acknowledge the imperative necessity of integrating comprehensive vegetation systems, recreational amenities, and natural landscapes into sophisticated urban planning frameworks that prioritize ecological resilience and environmental sustainability.\n""
""Metropolitan regions featuring abundant green infrastructure demonstrate quantifiably superior atmospheric quality indicators and enhanced environmental performance metrics. Trees and botanical specimens function as sophisticated biological filtration mechanisms, systematically absorbing atmospheric carbon dioxide concentrations while simultaneously releasing oxygen through intricate photosynthetic biochemical processes. This natural purification apparatus effectively neutralizes airborne contaminants and particulate matter, which constitute predominant environmental hazards in densely populated urban centers. When residents consistently inhale purified atmospheric conditions, they experience substantially diminished prevalence of respiratory pathologies, cardiovascular complications, and other pollution-induced physiological disorders.\n""
""Green spaces additionally furnish essential thermoregulatory mechanisms within urban microclimates and contribute to atmospheric stabilization. Cities characteristically exhibit significantly elevated ambient temperatures compared to peripheral rural territories due to the urban heat island phenomenon, wherein concrete infrastructure and architectural structures systematically absorb and retain solar thermal radiation. Trees provide organic cooling systems through shade provision and evapotranspiration processes, which discharge moisture vapor into surrounding atmospheric conditions through sophisticated biological mechanisms. This natural cooling apparatus substantially reduces dependency on energy-intensive mechanical climate control technologies, consequently minimizing electricity consumption and associated operational expenditures while promoting environmental sustainability.\n""
""Public parks and botanical gardens constitute accessible recreational facilities and therapeutic environments for metropolitan inhabitants seeking respite from urban stressors. Numerous urban residents lack adequate private outdoor spaces, rendering communal green environments essential for physical activities, psychological wellness maintenance, and social cohesion. These spaces accommodate diverse recreational pursuits including cardiovascular exercise regimens, contemplative meditation practices, and community social gatherings that foster neighborhood solidarity.\n""
""Urban green corridors simultaneously facilitate biodiversity conservation initiatives by establishing viable habitats for diverse wildlife populations and promoting ecological connectivity. Even relatively modest parks can sustain thriving communities of avian species, arthropod populations, and small mammalian species, contributing to ecological equilibrium within metropolitan ecosystems. These interconnected green networks enable species migration patterns and genetic diversity preservation, which are fundamental prerequisites for urban environmental resilience and ecosystem stability.\n""
""However, implementing comprehensive urban greening initiatives presents formidable logistical, economic, and political challenges requiring innovative solutions. Prime metropolitan real estate commands exceptionally high market valuations, rendering land acquisition for park development economically prohibitive for municipal budgets operating under fiscal constraints. Occasionally, existing infrastructure requires systematic demolition to accommodate new green spaces, potentially displacing established residential or commercial enterprises and generating substantial community resistance and political opposition.\n""
""Municipal administrations must allocate considerable financial resources for perpetual maintenance of green infrastructure systems, including horticultural management, irrigation networks, security surveillance, and facility maintenance protocols that ensure long-term sustainability and public accessibility.\n""",都市緑化が環境と健康に与える便益を2つ挙げて、それぞれのメカニズムを科学的に説明してください。（50語以内）,都市緑化事業を実施する際の主要な制約要因は何だと思いますか。テキストの内容に基づいて答えてください。（50語以内）
7,narrative,"""My nomenclature is Yuki. I am an undergraduate scholar pursuing a rigorous academic trajectory in economic sciences. Last month, I endeavored to procure employment at an intimate coffee establishment strategically positioned proximate to my university campus.\n""
""I experienced profound apprehension and trepidation during my inaugural professional engagement. I had never previously cultivated competency within the hospitality sector's intricate operational paradigms. The proprietor, Mr. Tanaka, exhibited extraordinary forbearance and magnanimity throughout my comprehensive orientation process. He meticulously elucidated the sophisticated artisanal techniques requisite for crafting diverse specialty coffee beverages and articulated comprehensive customer service protocols with remarkable precision and clarity. My colleagues demonstrated exceptional camaraderie and consistently provided invaluable mentorship whenever I encountered procedural impediments or operational complexities.\n""
""Initially, every occupational responsibility appeared formidable and seemingly insurmountable. I struggled to assimilate the extensive repertoire encompassing numerous intricate specialty beverages with their elaborate compositional specifications and nuanced preparation methodologies. My manual dexterity proved woefully inadequate while manipulating the sophisticated espresso machinery's complex mechanical apparatus. Intermittently, I committed egregious computational miscalculations during monetary transactions, inducing profound mortification and professional embarrassment. I experienced considerable distress when patrons exhibited overt frustration due to protracted service intervals and operational inefficiencies stemming from my inexperience.\n""
""Nevertheless, following approximately two weeks of rigorous practice and unwavering perseverance, my professional competency progressed substantially and demonstrably. I cultivated enhanced proficiency in beverage preparation methodologies and systematically memorized the individualized preferences, dietary specifications, and idiosyncratic requirements of regular clientele. These familiar patrons consistently acknowledged my presence with effusive greetings and commendations, substantially augmenting my professional confidence and self-efficacy.\n""
""Currently, I derive immense gratification and fulfillment from my employment at this distinguished establishment. I adhere to a meticulously structured schedule encompassing three afternoon shifts weekly, strategically coordinated with my demanding academic obligations and scholarly pursuits. The remuneration I receive facilitates autonomous procurement of educational resources and comprehensive management of personal expenditures without parental dependence.\n""
""More profoundly, this vocational experience furnished invaluable insights regarding collaborative workplace dynamics, sophisticated interpersonal communication strategies, and cross-cultural competency across diverse demographic constituencies.\n""
""My progenitors articulate profound admiration concerning my emerging professional maturity and burgeoning financial autonomy. I aspire to perpetuate this position throughout my remaining undergraduate tenure.\n""",ユキがアルバイト開始時に遭遇した困難を2つ挙げ、それらがどのように解決されたかを詳述してください。（50語以内）,このアルバイト経験でユキが獲得した技能はどのようなものだと考えられますか。テキストの記述を根拠に答えてください。（50語以内）
7,expository,"""Urban green infrastructure constitutes an indispensable cornerstone of sustainable metropolitan development paradigms and exerts profound ramifications on environmental quality parameters, ecological resilience, and public health outcomes. Contemporary cities worldwide progressively acknowledge the imperative necessity of integrating comprehensive vegetation systems, recreational amenities, and natural landscapes into sophisticated urban planning frameworks that prioritize ecological sustainability and environmental stewardship.\n""
""Metropolitan regions featuring abundant green infrastructure demonstrate quantifiably superior atmospheric quality indicators and enhanced environmental performance metrics. Trees and botanical specimens function as sophisticated biological filtration mechanisms, systematically sequestering atmospheric carbon dioxide concentrations while simultaneously releasing oxygen through intricate photosynthetic biochemical processes. This natural purification apparatus effectively neutralizes airborne contaminants, particulate matter, and noxious pollutants, which constitute predominant environmental hazards in densely populated urban centers. When residents consistently inhale purified atmospheric conditions, they experience substantially diminished prevalence of respiratory pathologies, cardiovascular complications, and other pollution-induced physiological disorders.\n""
""Green spaces additionally furnish essential thermoregulatory mechanisms within urban microclimates and contribute to atmospheric stabilization through complex ecological processes. Cities characteristically exhibit significantly elevated ambient temperatures compared to peripheral rural territories due to the urban heat island phenomenon, wherein concrete infrastructure and architectural structures systematically absorb and retain solar thermal radiation. Trees provide organic cooling systems through shade provision and evapotranspiration processes, which discharge moisture vapor into surrounding atmospheric conditions through sophisticated biological mechanisms. This natural cooling apparatus substantially reduces dependency on energy-intensive mechanical climate control technologies, consequently minimizing electricity consumption and associated operational expenditures while promoting environmental sustainability and carbon footprint reduction.\n""
""Public parks and botanical gardens constitute accessible recreational facilities and therapeutic environments for metropolitan inhabitants seeking respite from urban stressors and environmental degradation. Numerous urban residents lack adequate private outdoor spaces, rendering communal green environments essential for physical activities, psychological wellness maintenance, social cohesion, and community solidarity. These spaces accommodate diverse recreational pursuits including cardiovascular exercise regimens, contemplative meditation practices, and community social gatherings that foster neighborhood solidarity and cultural exchange.\n""
""Urban green corridors simultaneously facilitate biodiversity conservation initiatives by establishing viable habitats for diverse wildlife populations and promoting ecological connectivity across fragmented landscapes. Even relatively modest parks can sustain thriving communities of avian species, arthropod populations, and small mammalian species, contributing to ecological equilibrium within metropolitan ecosystems. These interconnected green networks enable species migration patterns, genetic diversity preservation, and ecosystem resilience, which are fundamental prerequisites for urban environmental sustainability.\n""
""However, implementing comprehensive urban greening initiatives presents formidable logistical, economic, and political challenges requiring innovative solutions and interdisciplinary collaboration. Prime metropolitan real estate commands exceptionally high market valuations, rendering land acquisition for park development economically prohibitive for municipal budgets operating under fiscal constraints and competing priorities. Occasionally, existing infrastructure requires systematic demolition to accommodate new green spaces, potentially displacing established residential or commercial enterprises and generating substantial community resistance, political opposition, and socioeconomic tensions.\n""
""Municipal administrations must allocate considerable financial resources for perpetual maintenance of green infrastructure systems, including horticultural management, sophisticated irrigation networks, comprehensive security surveillance, and facility maintenance protocols.\n""",都市緑化が環境と健康に与える便益を2つ挙げて、それぞれのメカニズムを科学的に説明してください。（50語以内）,都市緑化事業を実施する際の主要な制約要因は何だと思いますか。テキストの内容に基づいて答えてください。（50語以内）